{
  "form_name": "Test Form",
  "form_description": "A minimal valid config for testing",
  "version": "1.0",
  "sections": [
    {
      "id": 1,
      "name": "basics",
      "title": "Basic Information",
      "description": "Fundamental questions"
    },
    {
      "id": 2,
      "name": "details",
      "title": "Details",
      "description": "More detailed questions"
    }
  ],
  "questions": [
    {
      "id": "1",
      "section_id": 1,
      "question_text": "What is your name?",
      "question_type": "text",
      "priority": 1,
      "depends_on": null,
      "helper_text": "Enter your full legal name"
    },
    {
      "id": "2",
      "section_id": 1,
      "question_text": "Describe your background.",
      "question_type": "long_text",
      "priority": 2,
      "depends_on": null,
      "helper_text": "A brief paragraph about yourself"
    },
    {
      "id": "3",
      "section_id": 2,
      "question_text": "Are you currently employed?",
      "question_type": "yes_no",
      "priority": 1,
      "depends_on": null,
      "helper_text": null
    },
    {
      "id": "3a",
      "section_id": 2,
      "question_text": "If yes, describe your current role.",
      "question_type": "long_text",
      "priority": 2,
      "depends_on": "3",
      "helper_text": "Only answer if you said yes above"
    }
  ],
  "business_directions": [
    {
      "name": "Option A",
      "description": "First possible direction"
    },
    {
      "name": "Option B",
      "description": "Second possible direction"
    }
  ]
}
